,news_id,general_category,title,abstract,text,tfidf_vector,sbert_vector,openai_vector
368,N49007,football,Christian McCaffrey stopped inches short of goal line on final play of loss to Packers,"For the second time this season, a Panthers' loss has ended with McCaffrey just short of the end zone.","Christian McCaffrey stopped inches short of goal line on final play of loss to Packers For the second time this season, a Panthers' loss has ended with McCaffrey just short of the end zone.","[0.004055918398152504, -0.0720968949952966, -0.07504013507879866, 0.10635616258605496, 0.02176744859222563, -0.024973592999201533, -0.13316112987478393, -0.041755475080521326, 0.06216886772569302, -0.07829983328072561]","[-0.17008891701698303, 0.1935138702392578, -0.04690726473927498, 0.16843105852603912, 0.14174680411815643, -0.10407588630914688, 0.02516110986471176, -0.03149127587676048, -0.18486042320728302, 0.17360632121562958]","[0.07383596318448601, -0.14991018650897914, 0.09501519006784365, -0.1649929545240489, -0.10545510551569887, 0.05884006156839717, -0.1413939503120749, 0.13158921889043507, 0.04798176868774808, -0.015868491990527627]"
369,N1445,football,NFL bust Ryan Leaf explained why he's worried about Baker Mayfield,Time to worry about Baker Mayfield?,NFL bust Ryan Leaf explained why he's worried about Baker Mayfield Time to worry about Baker Mayfield?,"[0.11769509313672206, 0.007129529607694979, 0.06085006751339628, -0.01966801744648458, 0.12139855545601187, -0.19890750369732324, -0.031104657816297617, -0.22739819520339857, 0.07415252481583903, -0.26174639588370174]","[-0.2460271567106247, -0.19564855098724365, -0.11389026790857315, -0.0420355349779129, 0.03481054678559303, -0.11851124465465546, -0.050931766629219055, -0.000687957217451185, -0.1187780499458313, 0.18851134181022644]","[0.22806802691193168, 0.04128700863395037, -0.10095880238746018, 0.08586102648853279, 0.03007042995744646, 0.07503934271776372, -0.041384530611144756, 0.013655021788603488, -0.11332443580241784, 0.0664965993661087]"
370,N22104,football,Dalvin Cook 2019 vs. Adrian Peterson 2012: It's a fair comparison,"There might not be anything to compare to Adrian Peterson's incredible 2012 season, when he won the NFL's MVP award after leading the Vikings to the playoffs and nearly establishing a single-season league rushing record. Here's a reminder of some of the particulars, in case time has dulled them: Peterson averaged 6.0 yards per carry that season, all while carrying the ball 348 times and facing ...","Dalvin Cook 2019 vs. Adrian Peterson 2012: It's a fair comparison There might not be anything to compare to Adrian Peterson's incredible 2012 season, when he won the NFL's MVP award after leading the Vikings to the playoffs and nearly establishing a single-season league rushing record. Here's a reminder of some of the particulars, in case time has dulled them: Peterson averaged 6.0 yards per carry that season, all while carrying the ball 348 times and facing ...","[0.026430918982246705, -0.00508330223588955, 0.05364897127495701, -0.021392767537181074, 0.06005754721844774, 0.060425516119502136, -0.05415122637170754, -0.0799922598223125, 0.027124033497927018, -0.07577819210840268]","[-0.30787745118141174, 0.02476247400045395, -0.052365973591804504, -0.0882703885436058, 0.03355801850557327, 0.0313674695789814, 0.1485327035188675, 0.1839783787727356, 0.050562355667352676, -0.11011963337659836]","[0.10317362168725178, -0.08731033803431343, 0.018757541306336924, -0.13884128518648808, 0.0747961837182129, -0.027961120242795956, -0.14891497544412305, 0.02180224215159247, -0.01750080623208699, -0.2030684952882697]"
371,N28472,basketball,"LeBron James, Anthony Davis, Draymond Green all out Monday","The two stars for the Los Angeles Lakers will get a rest tonight, as well Golden State Warriors forward Draymond Green.","LeBron James, Anthony Davis, Draymond Green all out Monday The two stars for the Los Angeles Lakers will get a rest tonight, as well Golden State Warriors forward Draymond Green.","[-0.10155053908042178, -0.006792409021789875, -0.0764233782014069, -0.05467682335909881, 0.1012709893429624, 0.07974732617820883, -0.0890873055857959, 0.160011366152608, 0.042249984951430175, -0.043609822663751865]","[0.06574942171573639, -0.028506480157375336, 0.23918180167675018, -0.30121681094169617, 0.15092647075653076, 0.2609305679798126, -0.11815899610519409, -0.04034558683633804, -0.1311911642551422, -0.11583979427814484]","[-0.08631181099218109, 0.09702971924661034, -0.018782961759153977, 0.17075011368985715, -0.19531892556951685, -0.2896356960521167, -0.10886128077030664, -0.09157945763664598, -0.2018337370767657, 0.03778096550501207]"
372,N11472,golf,Louis Oosthuizen offered a rather honest assessment of his latest hole-in-one,Louis Oosthuizen admits his latest hole-in-one at the WGC-HSBC Champions wasn't exactly a perfect strike.,Louis Oosthuizen offered a rather honest assessment of his latest hole-in-one Louis Oosthuizen admits his latest hole-in-one at the WGC-HSBC Champions wasn't exactly a perfect strike.,"[-0.04562137981330247, 0.02353415681859668, -0.021695134618569673, -0.02493509572440901, 0.005783603119123677, -0.03141767381208857, 0.04138096945016701, -0.018187529509123918, -0.032534815703202394, -0.06194381103930184]","[0.23315231502056122, -0.11916480213403702, 0.10440581291913986, 0.1785036325454712, 0.06908997893333435, -0.2621612548828125, -0.06678013503551483, 0.1725282222032547, -0.01863066852092743, -0.07943134754896164]","[-0.09791793219508237, 0.19659664259309775, -0.04343139460779508, -0.14940971056126906, 0.05665526315908249, 0.12368413781048494, -0.2716425221844331, 0.11466956146992721, -0.026172186623876912, 0.06845780437308942]"
373,N13867,racing,"After wild second round finish, what awaits NASCAR drivers at Martinsville?",David Scott of the Charlotte Observer looks at the NASCAR playoff field,"After wild second round finish, what awaits NASCAR drivers at Martinsville? David Scott of the Charlotte Observer looks at the NASCAR playoff field","[-0.08096250162286511, -0.08494260040532552, 0.04764794738572366, -0.07666562990614871, -0.05751473562676076, -0.21611919101910512, 0.2698358718874848, 0.06845280966700927, 0.06331231351757907, -0.06981683310035446]","[0.09048599749803543, 0.13440124690532684, 0.11670682579278946, 0.30608537793159485, -0.10153760015964508, 0.16567018628120422, -0.12820802628993988, 0.35127875208854675, -0.002090106252580881, -0.02757030539214611]","[-0.12300182544829096, -0.049058455000559366, -0.1539333172838748, -0.27397607997976114, 0.026262264292552608, -0.08816862897986481, 0.03226855982121055, 0.2917527872274723, -0.06559658995234288, -0.042810864275059445]"
374,N53868,football,"With trade deadline approaching, has Minshew made Foles expendable?","Beating the Jets isn't really a reason for huge celebration, but even so, it's worth noting just how well Jaguars quarterback Gardner Minshew played in Jacksonville's 29-15 victory. Minshew threw for 279 yards, three touchdowns and zero interceptions, keeping his head and his composure throughout. Jacksonville is now 4-4, and at the moment of the victory was just half a game behind the Texans for the sixth and final playoff spot.","With trade deadline approaching, has Minshew made Foles expendable? Beating the Jets isn't really a reason for huge celebration, but even so, it's worth noting just how well Jaguars quarterback Gardner Minshew played in Jacksonville's 29-15 victory. Minshew threw for 279 yards, three touchdowns and zero interceptions, keeping his head and his composure throughout. Jacksonville is now 4-4, and at the moment of the victory was just half a game behind the Texans for the sixth and final playoff spot.","[-0.02189901058685064, -0.029172749319038318, -0.010831474022504048, 0.011156157129959739, -0.08886377863726591, -0.02457274969182266, -0.03841966876063264, -0.09221317746968921, -0.012566153341964788, -0.023019281530609538]","[-0.2876017987728119, -0.20982125401496887, -0.024251028895378113, 0.060630809515714645, -0.11676251888275146, 0.060120366513729095, 0.03170511871576309, 0.07219846546649933, -0.0817936435341835, 0.1639428585767746]","[0.10500154258420655, -0.14652247739764698, -0.04917930770909257, 0.005458695256153782, 0.04457992806182988, 0.030399725346364332, -0.03699033042810692, 0.09744834948129255, 0.09550226507400827, -0.024022395159953504]"
375,N30358,baseball,2019 Astros review: Alex Bregman,"Over the next few weeks on Texas Sports Nation, we will analyze the 2019 season of each major Astros contributor. Alex Bregman In 2018: .286/.394/.532, .926 OPS, 170 H, 83 XBH, 31 HR, 96 BB, 85 K, All-Star Game MVP, 6.9 bWAR, 7.6 fWAR In 2019: .296/.423/.592, 1.015 OPS, 164 H, 80 XBH, 41 HR, 119 BB, 83 K, 8.4 bWAR, 8.5 fWAR Analysis: If last season was Alex Bregman's breakout, this year cemented the Astros' third baseman as one of baseball's...","2019 Astros review: Alex Bregman Over the next few weeks on Texas Sports Nation, we will analyze the 2019 season of each major Astros contributor. Alex Bregman In 2018: .286/.394/.532, .926 OPS, 170 H, 83 XBH, 31 HR, 96 BB, 85 K, All-Star Game MVP, 6.9 bWAR, 7.6 fWAR In 2019: .296/.423/.592, 1.015 OPS, 164 H, 80 XBH, 41 HR, 119 BB, 83 K, 8.4 bWAR, 8.5 fWAR Analysis: If last season was Alex Bregman's breakout, this year cemented the Astros' third baseman as one of baseball's...","[-0.11312609151890542, 0.033984406607256726, 0.24913598640661294, 0.06035552908454707, 0.06252485757554975, 0.11376047821414671, -0.11630798800495165, -0.03224989643790233, -0.033702365470615246, 0.15211389489702884]","[0.09010611474514008, -0.24189244210720062, -0.030642151832580566, 0.1264370083808899, 0.040512654930353165, 0.22172501683235168, 0.4431716501712799, -0.057002753019332886, 0.07917875796556473, 0.02685127966105938]","[0.0033022686816475675, 0.1792340279004355, -0.20672563333577468, -0.0661117777054067, 0.18681105242688478, -0.11818517589681635, -0.0990430333111982, -0.1853334204771929, 0.1311783852558783, -0.15073986964502917]"
376,N23228,basketball,Fenwick volleyball edges Highland for Division II state title,The Falcons rallied after dropping the first set en route to the program's second state volleyball title.,Fenwick volleyball edges Highland for Division II state title The Falcons rallied after dropping the first set en route to the program's second state volleyball title.,"[-0.12004300769806993, -0.05488861434933478, -0.005016550899299859, -0.07496938094897876, -0.09550320693244656, 0.0020932446998389188, -0.019021008103264462, 0.07164077601777726, 0.03250234370163139, -0.06016553862777516]","[0.22965548932552338, 0.2624727785587311, -0.023973990231752396, 0.05490585044026375, 0.08182457834482193, -0.07244224101305008, 0.037440016865730286, 0.04517155885696411, -0.05901666730642319, 0.08216507732868195]","[-0.2880229709063794, -0.06513806102879409, 0.10338655878771802, -0.05056266834362289, 0.048379482481632756, 0.062474662774135964, 0.06817522618908299, -0.05675867911965762, 0.05159919431706668, -0.16079055350374272]"
377,N56639,basketball,"LeBron James Needs Evolve, Get More Aggressive if Lakers Want to Make a Run","Tuesday night the tandem of LeBron James and Anthony Davis debuted for the new-look Los Angeles Lakers against Kawhi Leonard and the new-look Los Angeles Clippers. Round 1 went to Kawhi and company as they knocked off the Lakers 112-102. In the process, James looked shaky and passive offensively. That must change if the Lakers are going to reach their lofty expectations this season. James finished the opener with 18 points, nine rebounds, eight...","LeBron James Needs Evolve, Get More Aggressive if Lakers Want to Make a Run Tuesday night the tandem of LeBron James and Anthony Davis debuted for the new-look Los Angeles Lakers against Kawhi Leonard and the new-look Los Angeles Clippers. Round 1 went to Kawhi and company as they knocked off the Lakers 112-102. In the process, James looked shaky and passive offensively. That must change if the Lakers are going to reach their lofty expectations this season. James finished the opener with 18 points, nine rebounds, eight...","[-0.09625628606191948, 0.06440103684309895, -0.050405428510114925, -0.08805109261220902, 0.11377144836760626, 0.12124816884304257, -0.08292994537059907, 0.1563076707747561, 0.07949751377824946, -0.06202462446328379]","[0.12644731998443604, -0.14453774690628052, 0.17340756952762604, -0.44511866569519043, -0.034381963312625885, -0.03237565606832504, 0.05288805440068245, 0.04163855314254761, -0.0301200058311224, -0.06258322298526764]","[-0.10518041151025144, 0.020283771805365013, -0.16614437543280647, 0.25224852840993794, -0.07234155830511507, -0.07189186956084875, -0.1174900336226251, 0.03087622727404042, -0.18422246644922033, -0.018368530759228563]"
378,N48364,football,Packers Wire staff predictions: Week 6 vs. Lions,Predicting the outcome of the Packers' Week 6 visit from the Detroit Lions.,Packers Wire staff predictions: Week 6 vs. Lions Predicting the outcome of the Packers' Week 6 visit from the Detroit Lions.,"[0.35283262767371676, -0.28655781691725896, -0.06123003390383087, 0.2260854806284594, 0.16662668026758748, -0.14271705052170677, -0.18799005734202653, 0.4186705146000799, -0.23647467513401935, -0.019901956830531746]","[-0.27087798714637756, 0.30997392535209656, 0.17431166768074036, 0.10521625727415085, -0.15837784111499786, 0.09585721790790558, -0.19369709491729736, -0.016237566247582436, -0.016791779547929764, -0.17435520887374878]","[0.12852585817318313, -0.3296808422306626, -0.07702331517250445, -0.06912177831329264, 0.033886168504105765, -0.11989623767425406, 0.09399952323332797, -0.08739980973156043, -0.07210677667913229, 0.08107035425535825]"
379,N36409,football,"Michigan, Jim Harbaugh make late push for 2020 QB C.J. Stroud","Michigan is going to try and land a quarterback for its 2020 recruiting class after all. Just days after commit J.D. Johnson, of Arizona, announced his plans to medically retire from football, Jim Harbaugh and his coaching staff extended a scholarship offer to C.J. Stroud. Stroud, a four-star quarterback from Rancho Cucamonga, Calif., has not yet settled on a school -- but he has plenty of ...","Michigan, Jim Harbaugh make late push for 2020 QB C.J. Stroud Michigan is going to try and land a quarterback for its 2020 recruiting class after all. Just days after commit J.D. Johnson, of Arizona, announced his plans to medically retire from football, Jim Harbaugh and his coaching staff extended a scholarship offer to C.J. Stroud. Stroud, a four-star quarterback from Rancho Cucamonga, Calif., has not yet settled on a school -- but he has plenty of ...","[-0.05927064102261884, -0.02867876471404473, -0.10350163275014669, -0.07364417915941994, -0.014830753560555413, -0.038199642252476955, -0.0670975266179705, -0.02894430828973336, 0.004186559399358162, 0.1171633930461212]","[-0.08721685409545898, -0.018773097544908524, -0.41719475388526917, 0.019990727305412292, -0.12103619426488876, 0.046613406389951706, 0.019610442221164703, 0.06097394600510597, 0.05792967602610588, 0.2327568382024765]","[-0.05099199770469921, 0.07358767580724324, 0.25730243021380805, -0.07783427431574758, 0.1740314407014417, 0.042184330077504856, -0.05790545318252352, 0.017388604332189205, -0.03156824023796328, 0.06719477758473799]"
380,N49841,football,Tom Brady doesn't want you to blame Julian Edelman: 'He was trying to get yards',Brady's most-trusted receiver committed a costly fumble that led to a 70-yard return for a touchdown in Sunday night's 37-20 loss at Baltimore.,Tom Brady doesn't want you to blame Julian Edelman: 'He was trying to get yards' Brady's most-trusted receiver committed a costly fumble that led to a 70-yard return for a touchdown in Sunday night's 37-20 loss at Baltimore.,"[0.06867982024385226, 0.20202763537774593, -0.1070424426638858, 0.0821286075080179, -0.14777363784624417, -0.021884876344576424, -0.008185455717844271, 0.0918854072919984, 0.08416505628324814, -0.028646405183859334]","[-0.3456410765647888, -0.012890353798866272, 0.08943968266248703, -0.036057401448488235, 0.2997192442417145, -0.24976570904254913, 0.03142920508980751, -0.0628175213932991, 0.16797687113285065, 0.2153497338294983]","[0.2702993489577228, 0.024887819900310852, 0.09399469431734575, -0.05254730175283913, -0.20135244361550972, 0.29448339451860406, -0.30930078861397126, -0.010110343608752022, -0.0061973044926733984, 0.00010018013116782624]"
381,N32045,basketball,"Stanley scores 19, leads No. 4 Duke past Colorado State, 89-55",No. 4 Duke rolled to a lopsided win against Colorado State,"Stanley scores 19, leads No. 4 Duke past Colorado State, 89-55 No. 4 Duke rolled to a lopsided win against Colorado State","[-0.10341655850410636, -0.078811520922454, -0.048545739095182984, -0.06276722882687626, -0.12025037657628326, -0.010094193548932817, -0.050167833979661215, 0.02689138535525161, -0.006141083403122866, -0.04875032874270111]","[0.30019932985305786, 0.26087686419487, -0.08379143476486206, -0.13684570789337158, 0.0026323471684008837, -0.03780379518866539, 0.13630148768424988, 0.058258816599845886, -0.057778190821409225, 0.07963861525058746]","[-0.3393253942746382, -0.059984792736768114, 0.0886797825799841, 0.14102695533922435, -0.023110450218930625, 0.006064246936870954, -0.11432998388829806, 0.1261398038492316, 0.08127096985430508, -0.11336867031755207]"
382,N3547,football,Report: Angels knew of Tyler Skaggs' drug use 'long before his death',"A new report indicates the Los Angeles Angels were aware of Tyler Skaggs' opioid use but, the team's director of communications, Eric Kay, provided DEA agents with names of five other players he believed were using opioids.","Report: Angels knew of Tyler Skaggs' drug use 'long before his death' A new report indicates the Los Angeles Angels were aware of Tyler Skaggs' opioid use but, the team's director of communications, Eric Kay, provided DEA agents with names of five other players he believed were using opioids.","[-0.004002607395324822, 0.0717587831056405, -0.03557022031185376, 0.01602018573957696, 0.06894000296595716, 0.03657479711572337, 0.009072982435735158, 0.04486072069424882, -0.012851594907097334, 0.05214179835973363]","[0.060190651565790176, -0.26015934348106384, 0.04205324500799179, 0.0856705754995346, 0.011590443551540375, -0.010534337721765041, 0.11654095351696014, -0.1878211349248886, 0.0010264518205076456, 0.0019327565096318722]","[0.04649905197715313, 0.2973560583373448, -0.050914975409622795, -0.04133311326853741, -0.12041643876505576, -0.0314634450290691, 0.1357107247369386, -0.02204497190391719, 0.004597017334900586, 0.0340555888816715]"
383,N61573,basketball,Drummond: I'm 'definitely' the best rebounder in NBA history,"Andre Drummond, now in his eighth season, has been widely hailed as among the better rebounders in the NBA.","Drummond: I'm 'definitely' the best rebounder in NBA history Andre Drummond, now in his eighth season, has been widely hailed as among the better rebounders in the NBA.","[-0.1305863852230695, 0.06732208848218717, 0.13445162605339098, -0.20667996413448037, 0.3178856349040317, 0.253785829904245, -0.08778635359269298, 0.19599498666037493, 0.22021129595787475, -0.1013811137059778]","[0.25036606192588806, -0.08919575810432434, 0.00045458468957804143, -0.3263567388057709, 0.012810632586479187, -0.104385145008564, 0.15351448953151703, 0.2736178934574127, 0.1062764823436737, -0.14297565817832947]","[-0.08263526607639703, 0.17314464177028752, -0.034063800365760406, 0.17997530832455108, -0.03365246719376075, -0.015696446879183545, -0.12055422914024995, -0.09040428754974858, -0.21248317944764558, -0.1925592264115067]"
384,N41710,tennis,Osaka withdraws from WTA finals with shoulder injury,Osaka withdraws from WTA finals with shoulder injury,Osaka withdraws from WTA finals with shoulder injury Osaka withdraws from WTA finals with shoulder injury,"[-0.004275040597068891, -0.015009401352397303, -0.04624367956188222, 0.09266349344763687, 0.053245821968686595, 0.05930573902613266, 0.0702014599358743, -0.037901157817003664, 0.004208177977058776, 0.0343945207664465]","[0.21051767468452454, -0.09177983552217484, 0.02584022283554077, 0.026144083589315414, 0.2571176588535309, 0.1736733615398407, -0.12502503395080566, -0.1459682732820511, -0.060570571571588516, -0.034016601741313934]","[-0.004742189106688189, 0.11287107390332116, 0.15844262312461269, -0.06190904204459634, -0.17049825437219332, -0.2143736085621852, -0.051694195092420625, -0.054407185384768804, 0.05009447260849358, 0.060310980308904964]"
385,N44216,basketball,Nahziah Carter sparks Huskies to 56-46 victory over Mount St. Mary's,"SEATTLE -- Nahziah Carter decided enough was enough. With 9:35 left in the game and Washington clinging to a four-point lead over Mount St. Mary's, Carter got out in transition. And then he saw the opening. Just after crossing the 3-point line, he took two steps and flew, launching himself toward the basket for a one-handed dunk that ignited Alaska Airlines Arena. The Huskies' bench ...","Nahziah Carter sparks Huskies to 56-46 victory over Mount St. Mary's SEATTLE -- Nahziah Carter decided enough was enough. With 9:35 left in the game and Washington clinging to a four-point lead over Mount St. Mary's, Carter got out in transition. And then he saw the opening. Just after crossing the 3-point line, he took two steps and flew, launching himself toward the basket for a one-handed dunk that ignited Alaska Airlines Arena. The Huskies' bench ...","[-0.06552901398360074, -0.024818025768459512, -0.0178851932440114, 0.020639775686420038, -0.07470481008627242, 0.0250060714125485, -0.04818427857815132, -0.043997845610644626, -0.00490224163586931, -0.021545725196342447]","[0.2544991075992584, 0.23833726346492767, -0.0899011418223381, -0.14808562397956848, 0.11403238773345947, -0.12749679386615753, 0.09684795886278152, -0.06339691579341888, -0.10551594942808151, 0.07223118096590042]","[-0.29318628151223264, 0.05556471187228282, 0.12010832816800646, 0.1521487575100929, -0.09986556786020223, 0.08167782098293638, -0.03502557550222859, 0.08120085355713204, 0.1973473946527567, -0.05523726698864507]"
386,N47864,racing,Inspection issues bar SHR No. 4 from qualifying at Kansas; JGR No. 19 also docked,"NASCAR officials ejected the car chiefs for two Monster Energy Series teams and held the Stewart-Haas Racing No. 4 Ford for Kevin Harvick out of qualifying after multiple issues in Saturday's pre-qualifying inspection at Kansas Speedway. The infractions came before Busch Pole Qualifying to set the field for Sunday's Hollywood Casino 400 (2:30 p.m. ET, []","Inspection issues bar SHR No. 4 from qualifying at Kansas; JGR No. 19 also docked NASCAR officials ejected the car chiefs for two Monster Energy Series teams and held the Stewart-Haas Racing No. 4 Ford for Kevin Harvick out of qualifying after multiple issues in Saturday's pre-qualifying inspection at Kansas Speedway. The infractions came before Busch Pole Qualifying to set the field for Sunday's Hollywood Casino 400 (2:30 p.m. ET, []","[-0.042109518513738065, -0.04624775009281945, 0.035964046262520706, 0.04666269123279636, -0.002834540427420167, -0.14943503077613898, 0.17662418993246015, 0.020322482912534388, 0.09974838988460467, -0.026594367286061366]","[0.038209859281778336, 0.07842221111059189, 0.12092836201190948, 0.27602261304855347, 0.1504540890455246, 0.14305616915225983, -0.21081262826919556, 0.1731574982404709, -0.013152455911040306, -0.010459587909281254]","[-0.021877711495883634, 0.04178272536094776, -0.002055386392117825, -0.2966157217691435, -0.1837496959765763, -0.10213271535409463, 0.12446523541758815, 0.2796372019873284, -0.008468042800505454, 0.07709493464203535]"
387,N5757,basketball,"Bucks to pick up team options for Donte DiVincenzo, D.J. Wilson",The last two first-round draft picks selected by the Milwaukee Bucks will be under contract for another year. The Bucks will exercise their 2020-'21 team options for D.J. Wilson and Donte DiVincenzo.,"Bucks to pick up team options for Donte DiVincenzo, D.J. Wilson The last two first-round draft picks selected by the Milwaukee Bucks will be under contract for another year. The Bucks will exercise their 2020-'21 team options for D.J. Wilson and Donte DiVincenzo.","[-0.04789917831947125, 0.044248983795548494, -0.014567256912936045, -0.06175413722121137, 0.04198255742279663, -0.018143055848936086, 0.02479710075854086, -0.02466488574827003, -0.0328553843392011, -0.010857374691266611]","[0.015045588836073875, -0.22716088593006134, -0.025420187041163445, -0.22063656151294708, -0.2092607170343399, 0.19104114174842834, -0.03400200977921486, 0.0692293718457222, 0.054414015263319016, -0.012237084098160267]","[-0.053981550517759755, 0.19195996377114452, 0.08493675709870659, 0.17779643379970395, -0.058659115674989167, -0.1330406301860671, 0.14401154091267493, 0.07242269661951266, -0.0735952136196872, -0.14978942903113154]"
