,news_id,general_category,title,abstract,text,tfidf_vector,sbert_vector,openai_vector
0,N54735,football,This former N.J. high school football star has been this season's best NFL trade acquisition | Here's why,"When the Steelers traded a first round draft pick to the Miami Dolphins for second-year free safety Minkah Fitzpatrick, a common reaction was that Pittsburgh got fleeced out of a likely top 10 selection. Two months later, it's clear that it was the Steelers that got away with highway robbery. The Old Bridge native has been playing out of his mind since moving back north. Through seven games in ...","This former N.J. high school football star has been this season's best NFL trade acquisition | Here's why When the Steelers traded a first round draft pick to the Miami Dolphins for second-year free safety Minkah Fitzpatrick, a common reaction was that Pittsburgh got fleeced out of a likely top 10 selection. Two months later, it's clear that it was the Steelers that got away with highway robbery. The Old Bridge native has been playing out of his mind since moving back north. Through seven games in ...","[0.05745462481436752, 0.012450696941838058, -0.01596280256755006, -0.1169083509330994, 0.01440837761077667, -0.06665394353131236, -0.09934369907481005, -0.2053830465396326, -0.08205998431184569, 0.047617316004198884]","[-0.30034834146499634, -0.1283886581659317, -0.17792321741580963, 0.002186661586165428, -0.01805678755044937, -0.05110333114862442, 0.11943037807941437, -0.02529830113053322, 0.08680958300828934, -0.03825477883219719]","[0.23808536014335005, -0.005952934609347428, 0.027083082920010795, 0.07524905111149686, 0.16445533059208542, 0.1455479872539345, 0.011660976281078834, 0.01174022280432328, 0.010067261907404501, -0.24976342464312298]"
1,N39049,baseball,"Cubs By The Numbers: At last, a mystery about an unknown uniform number is solved",The single missing Cubs uniform number has been found... and it's got a fascinating story behind it.,"Cubs By The Numbers: At last, a mystery about an unknown uniform number is solved The single missing Cubs uniform number has been found... and it's got a fascinating story behind it.","[-0.026890831777120358, 0.04043696012799046, -0.005898285961368199, -0.005620714679084696, 0.00010766699221297316, -0.040931173454207784, 0.0049936652556529185, -0.019282320575575274, -0.03783967107991848, 0.051982863267279064]","[0.14353080093860626, -0.02020365558564663, 0.03493219614028931, 0.040235891938209534, -0.09600239992141724, 0.004890682175755501, 0.04995645955204964, -0.22214603424072266, -0.105575792491436, -0.026876727119088173]","[-0.10545920821229135, 0.13336951076965173, -0.08135881275232845, -0.018813258476601914, 0.07296244995149125, 0.049572069122778756, 0.14833870593213702, -0.09181486053919292, 0.1008199278061057, -0.08323845330155379]"
2,N44697,basketball,"With Warriors crumbling, there's officially a new most hated team in the NBA",Sportsinsider.com's extensive Twitter analysis revealed that California-based teams are hated above all other NBA franchises.,"With Warriors crumbling, there's officially a new most hated team in the NBA Sportsinsider.com's extensive Twitter analysis revealed that California-based teams are hated above all other NBA franchises.","[-0.017195313112828927, 0.10645503295532462, 0.1096261816563996, -0.1999729271318505, 0.2128751844430401, 0.17895487762977216, -0.04418041679155343, 0.2014249979034932, 0.2263993212410716, -0.05636326821743494]","[0.20831860601902008, -0.056611135601997375, 0.20138706266880035, -0.2511627674102783, -0.16168774664402008, 0.04313551262021065, -0.1316508650779724, -0.12358006834983826, 0.2545941174030304, -0.06774666905403137]","[-0.13073979211179057, 0.04696464637243465, -0.1474720765239189, 0.1127300652237166, -0.1665881882145789, 0.10381284156640727, 0.0821555479371583, -0.19518085628169324, -0.2905133808669834, -0.07233577734096414]"
3,N22374,football,Chiefs vs Vikings: Five stats to know,Five numbers to know ahead of the Chiefs taking on the Packers on Sunday Night Football,Chiefs vs Vikings: Five stats to know Five numbers to know ahead of the Chiefs taking on the Packers on Sunday Night Football,"[0.13285583051589242, -0.15491247306736083, -0.15599812920767323, 0.16727348173443607, 0.027878075364392713, -0.05021079971555814, 0.06146997248944059, 0.09969019350784354, 0.21264158153546187, 0.20686366317865953]","[-0.3191804587841034, 0.428677499294281, 0.20438426733016968, 0.027254687622189522, -0.04712692275643349, 0.0602896548807621, -0.013887685723602772, 0.003762441221624613, -0.09604674577713013, -0.1360996812582016]","[0.053233423736338346, -0.3323710557016663, -0.10937074084309936, -0.09438740301090225, 0.008297583577419639, -0.16073820946960002, -0.01714054611201366, -0.030744431916770534, -0.07234059902231355, 0.12983635183922707]"
4,N53235,football,Texas grasping for answers after all-phases meltdown vs. TCU,The concrete walls encircling the field at Amon G. Carter Stadium weren't going to be enough to stop the flood.,Texas grasping for answers after all-phases meltdown vs. TCU The concrete walls encircling the field at Amon G. Carter Stadium weren't going to be enough to stop the flood.,"[0.01965769950902849, -0.06830360350390947, -0.062747002611497, 0.03412631649103859, -0.0669546102028809, 0.06241307236108395, 0.03333705208336924, 0.012285415243125212, -0.008458353074497224, -0.003480905760439801]","[0.10753381252288818, 0.14293721318244934, -0.05674657225608826, 0.059173211455345154, 0.05487113818526268, -0.04524650797247887, 0.04409421980381012, -0.2022024393081665, 0.004409241024404764, 0.07804403454065323]","[-0.16440199005870537, -0.0907970964022271, 0.001809079826509632, -0.032393224377659485, -0.04398811810942817, 0.26319532141268853, 0.0730472544335316, -0.03477899276918547, 0.18025578283832233, 0.24968111979757024]"
5,N9625,football,Saturday Dawg Chow: Browns news (10/19/19),More of the latest Browns news and notes from around the web in today's dose of the Saturday Dawg Chow.,Saturday Dawg Chow: Browns news (10/19/19) More of the latest Browns news and notes from around the web in today's dose of the Saturday Dawg Chow.,"[0.020850852920424327, 0.011382231122356187, -0.03149083024413392, -0.030046246605985046, -0.054457708160397786, 0.012312194258747626, -0.02172115030906794, -0.03545751021872659, -0.07474704367812869, -0.08342748751473937]","[-0.23155343532562256, 0.03989751636981964, -0.013196319341659546, 0.1334906965494156, -0.05290696397423744, -0.0792950987815857, -0.06910011917352676, -0.04948731139302254, -0.020618772134184837, -0.166280597448349]","[0.1161462516764, -0.13876269266240304, 0.041923334814508224, 0.051859444363412104, 0.04514496796145988, -0.02003240153412458, 0.1114304189224097, -0.12437220022855308, 0.11529077643538341, -0.1091455732614986]"
6,N7620,misc,Why Damian Lillard and C.J. McCollum have stayed loyal to Portland Trail Blazers,The Trail Blazers' Damian Lillard and C.J. McCollum represent the rare NBA stars who have resisted forging new alliances in different uniforms.,Why Damian Lillard and C.J. McCollum have stayed loyal to Portland Trail Blazers The Trail Blazers' Damian Lillard and C.J. McCollum represent the rare NBA stars who have resisted forging new alliances in different uniforms.,"[-0.033090472236349255, 0.09186158534416561, 0.031448733306031006, -0.07437572063900173, 0.10971500735859271, 0.11629247772677051, -0.0015395789540181288, 0.146215753996996, 0.08333359141899549, -0.04635401014855036]","[0.2023119479417801, -0.16530650854110718, -0.052442874759435654, -0.37783676385879517, -0.038014110177755356, -0.028986863791942596, 0.011136257089674473, -0.012602305971086025, 0.042894408106803894, -0.12699605524539948]","[-0.07223696205867666, 0.22046523417217417, -0.05107755198383063, 0.20100227144432695, -0.016897071945538463, 0.11202759070591652, -0.014857701858853498, 0.07079940722301556, -0.1700817102448728, -0.03653078427834145]"
7,N43670,basketball,Draymond criticizes official for ejection: 'Don't tell me not to talk',"Golden State Warriors forward Draymond Green made Chase Center history during Monday's loss to the Utah Jazz, becoming the first player ejected from a game in the new venue after arguing with an official. The three-time All-Star was given a second technical foul for continuing to plead his case after disagreeing with a blocking call, but it seems Green's spat with the official went beyond just that foul. ""I disagreed with that call,"" Green told...","Draymond criticizes official for ejection: 'Don't tell me not to talk' Golden State Warriors forward Draymond Green made Chase Center history during Monday's loss to the Utah Jazz, becoming the first player ejected from a game in the new venue after arguing with an official. The three-time All-Star was given a second technical foul for continuing to plead his case after disagreeing with a blocking call, but it seems Green's spat with the official went beyond just that foul. ""I disagreed with that call,"" Green told...","[-0.05800589816765717, -0.007856775500847344, -0.05003539507379252, 0.026946110122887345, -0.006632410025745973, -0.004454056097030979, -0.06849197880330177, 0.036305841059129984, 0.04512063990485922, -0.05415665062921772]","[0.195586159825325, -0.16499698162078857, 0.18937407433986664, -0.15602369606494904, 0.21575717628002167, -0.14152836799621582, -0.1446298509836197, -0.0512576587498188, -0.012064704671502113, -0.037040628492832184]","[-0.08779335894481174, 0.174032804566123, -0.016839690836427258, 0.13108623901168062, -0.30549356528903004, 0.10817911723491935, -0.0924309221478207, -0.021888281966907293, -0.06649197049050562, 0.11948651784491907]"
8,N18737,racing,"Keselowski after Kansas cut: 'I don't like it, but it's over now'","Brad Keselowski was eliminated from the NASCAR Playoff after the race at Kansas Speedway, finishing one spot below the cutline with his 19th-place run.","Keselowski after Kansas cut: 'I don't like it, but it's over now' Brad Keselowski was eliminated from the NASCAR Playoff after the race at Kansas Speedway, finishing one spot below the cutline with his 19th-place run.","[-0.07717632037813428, -0.04778043159421467, 0.016853874219456198, -0.03923197860718427, 0.004301358754089641, -0.22001845317539137, 0.3033527302434306, 0.05574440397993338, 0.03595529728991755, -0.05956151743889794]","[0.1296880543231964, 0.05809967592358589, 0.145123690366745, 0.24642612040042877, 0.14101964235305786, 0.07462989538908005, -0.15166504681110382, 0.3110474944114685, -0.05789904668927193, 0.2239372730255127]","[-0.06440909659422812, 0.017779495158004383, -0.07005725446064144, -0.2871645929340958, -0.2115272385739524, 0.01622555348267252, 0.03006769215270073, 0.2560728155672257, -0.049503757715417075, 0.043636367811163146]"
9,N56871,golf,Korn Ferry national qualifier field set at Orange County National,The Korn Ferry Tour National Qualifying Tournament field has been set with 114 players coming out of five second-stage qualifiers last week and this week. They advanced to Orange County National's Cat Crooked Cat and Panthers Lake Courses in Winter Garden Dec. 12-15 to determine eligibility onto the 2020 Korn Ferry Tour. Here's how the finish at OCN will decide the pecking order:   The ...,Korn Ferry national qualifier field set at Orange County National The Korn Ferry Tour National Qualifying Tournament field has been set with 114 players coming out of five second-stage qualifiers last week and this week. They advanced to Orange County National's Cat Crooked Cat and Panthers Lake Courses in Winter Garden Dec. 12-15 to determine eligibility onto the 2020 Korn Ferry Tour. Here's how the finish at OCN will decide the pecking order:   The ...,"[0.06806134946684786, -0.07761796346342716, 0.06997357403268126, -0.055532149600723696, -0.02068407055372179, -0.014416631092314341, 0.03934373121565107, -0.025789253840464585, 0.04060995364566862, 0.062442288252148634]","[0.2236003428697586, 0.12333060801029205, -0.17791809141635895, 0.20021773874759674, 0.005968901794403791, 0.07869593799114227, -0.20391236245632172, 0.0035003777593374252, -0.0358288399875164, -0.16236943006515503]","[-0.1780383880135966, 0.09245421091174554, 0.12538435527625835, -0.2463405423809078, 0.1018032835208982, -0.1299729261062127, 0.11901164940482088, 0.0706109007002435, -0.09888665900460258, -0.017770272952071987]"
10,N13544,football,Open thread: Is Matt Patricia on the hot seat?,The Lions are all but eliminated from postseason contention.,Open thread: Is Matt Patricia on the hot seat? The Lions are all but eliminated from postseason contention.,"[0.043176205366887106, -0.11298421069751491, -0.055316063717601026, 0.10919428047956883, 0.07665428544376078, -0.06588303309941275, -0.016109261782961917, 0.21338138954805322, -0.1964585837553638, -0.07201124725612294]","[-0.2772388756275177, -0.07739792764186859, 0.12209342420101166, 0.11195620894432068, -0.2028447538614273, -0.04313233494758606, -0.08468922972679138, 0.14636249840259552, -0.016758626326918602, 0.08055640757083893]","[0.22960402920046816, -0.18225088867223957, -0.10744639148157763, -0.0013905771174266529, 0.03884193032600122, 0.044941388648833035, 0.19848767550713467, -0.02391486120075418, -0.07486762619634875, 0.1044872540853971]"
11,N18913,baseball,"Babe Ruth's bat used for 500th homer, owned by Rockland family, hits auction block","In the mid-1940s, Ruth gave the bat to his friend Jim Rice, who was mayor of Suffern.","Babe Ruth's bat used for 500th homer, owned by Rockland family, hits auction block In the mid-1940s, Ruth gave the bat to his friend Jim Rice, who was mayor of Suffern.","[-0.030720718617837657, 0.03279245774951741, -0.006884461559689062, 0.003132408459705449, 0.011965102684955244, -0.02507907119825824, 0.005016963671405649, -0.01291645664758017, -0.0289991155899041, 0.009911948036467898]","[0.24634763598442078, -0.19483324885368347, 0.13655617833137512, 0.1943134218454361, 0.11389777809381485, 0.05922973155975342, 0.16719290614128113, -0.19800256192684174, 0.17033720016479492, -0.03924378752708435]","[0.048516696206287235, 0.3320821224583348, -0.03654772908584059, -0.22539196936116676, -0.09471577458230593, 0.03460984544674077, -0.0176025723992108, -0.15725253525950728, 0.06588004297846176, -0.13849036694908634]"
12,N38381,misc,2020 College Soccer Signing Tracker,National Signing Day kicked off the 2020 college soccer signing season on November 13,2020 College Soccer Signing Tracker National Signing Day kicked off the 2020 college soccer signing season on November 13,"[-0.07113384835349564, -0.0042488012300932005, -0.01781331703455264, -0.13067874655970219, 0.009652032631901012, -0.049240814895940344, 0.013642229837506006, -0.01583095242175815, -0.016459154324454175, 0.12445550413374826]","[0.1159343346953392, 0.007776808924973011, -0.2843882441520691, 0.009256759658455849, -0.08876089006662369, 0.19795766472816467, -0.04058931767940521, -0.034690964967012405, -0.05994339659810066, -0.027075553312897682]","[-0.17307437659459501, 0.08722329298049143, 0.13798500638421476, -0.07712808065517296, 0.22118600770544733, -0.05908416558745084, 0.11209295463624873, -0.08839499671744395, 0.08771344830719303, -0.0649519722437477]"
13,N50470,football,Patriots Practice Notes: Perfect Attendance At Rainy Halloween Session,FOXBORO Mass. -- Every New England Patriots players was present and accounted for Thursday at the team's penultimate practice of Week . The Patriots had perfect attendance at the rainy,Patriots Practice Notes: Perfect Attendance At Rainy Halloween Session FOXBORO Mass. -- Every New England Patriots players was present and accounted for Thursday at the team's penultimate practice of Week . The Patriots had perfect attendance at the rainy,"[0.2164400263304951, 0.30797934018296874, 0.01506921450215916, -0.007036551966991136, -0.12023183576138154, -0.02290080863088745, -0.0018728694146971571, 0.109679607458325, 0.10736680760234461, -0.002325283950468632]","[-0.12384365499019623, 0.08016815781593323, 0.15408751368522644, 0.017327336594462395, 0.148548424243927, 0.011045494116842747, -0.1370507925748825, -0.20732006430625916, 0.02885691449046135, 0.00262783863581717]","[0.17447686653763553, -0.10303069464228204, 0.04657303390628774, -0.040580424270521206, -0.04845582143379773, -0.08448879324212348, -0.07805603928151217, -0.13244139262876753, 0.0621391285062928, -0.0933498445421576]"
14,N25797,basketball,"Thunder: Both spurned by Paul George, Thunder and Pacers face off with strong replacements","On Tuesday, Paul George's two exes meet: Oklahoma City and Indiana. Both teams have been dumped by the six-time All-Star in the last three years. He's now with the one that got away, Los Angeles (although that metaphor works better for the city than the Clippers specifically). By the time Paul left OKC, he and his agent had figured out how to help facilitate a clean break. The split ...","Thunder: Both spurned by Paul George, Thunder and Pacers face off with strong replacements On Tuesday, Paul George's two exes meet: Oklahoma City and Indiana. Both teams have been dumped by the six-time All-Star in the last three years. He's now with the one that got away, Los Angeles (although that metaphor works better for the city than the Clippers specifically). By the time Paul left OKC, he and his agent had figured out how to help facilitate a clean break. The split ...","[-0.04523528755983588, 0.007660203759634606, -0.018195199013156915, -0.012509976132628803, 0.04149965795580524, -0.0010981913636572767, -0.011432654127386636, -0.059059114250869994, 0.005824953328291972, -0.0579020462153065]","[0.23225167393684387, -0.07299354672431946, 0.23767952620983124, -0.4070397913455963, -0.06234676390886307, 0.12641271948814392, -0.030472973361611366, -0.01615731231868267, 0.08470291644334793, -0.04186681658029556]","[-0.04154258225780496, 0.15012203313271785, -0.10174966125828104, 0.23422756240242187, -0.1499524292231459, 0.027974911291977485, 0.03215457489469639, -0.017886119320966582, -0.061415297049367094, 0.04525594329842106]"
15,N50858,football,Kirk Cousins is playing at an MVP level. Here's why it won't last.,"The Vikings are getting the good version of Good Kirk Cousins right now, but Bad Kirk Cousins could make a return very soon.","Kirk Cousins is playing at an MVP level. Here's why it won't last. The Vikings are getting the good version of Good Kirk Cousins right now, but Bad Kirk Cousins could make a return very soon.","[-0.014743836183470865, 0.012024279624379599, -0.004933347727066361, 0.019352240411546023, 0.04484146977709291, 0.032474017349596374, 0.0314777268995454, -0.04706800520321094, -0.024884402047385998, -0.012908303383530485]","[-0.30072060227394104, -0.09585262835025787, 0.06672608852386475, -0.17624926567077637, -0.033177148550748825, 0.022627143189311028, 0.12527671456336975, 0.11813954263925552, -0.033732108771800995, 0.05205187574028969]","[0.08819284676189608, -0.07038292054750413, -0.15220126642657497, 0.049817018530599395, 0.10660327923984825, -0.07919233637670782, -0.05348858676267938, 0.08500275865078406, 0.005864180666362307, 0.07041809688647321]"
16,N54237,football,Tom Brady Admits He's Still Not Over Super Bowl Loss to Eagles,"The last time the Patriots faced the Eagles was Super Bowl LII when Tom Brady threw for 505 yards, but still lost the game, 41-33. With the two teams meeting again this week, the game will be a topic over the course of the week and Brady was asked Monday morning on The Greg Hill Show how long it took for him to get over the loss? ""You assume I'm over it? Come on now,"" Brady said. ""That's a lot of mental scar tissue from that year. That was a...","Tom Brady Admits He's Still Not Over Super Bowl Loss to Eagles The last time the Patriots faced the Eagles was Super Bowl LII when Tom Brady threw for 505 yards, but still lost the game, 41-33. With the two teams meeting again this week, the game will be a topic over the course of the week and Brady was asked Monday morning on The Greg Hill Show how long it took for him to get over the loss? ""You assume I'm over it? Come on now,"" Brady said. ""That's a lot of mental scar tissue from that year. That was a...","[0.20753111533349328, 0.213453650963355, -0.018265683125822607, 0.11402934846554166, -0.24490200299836362, 0.06940083679130886, -0.0102614293088537, 0.09175648890343106, 0.05648472830227327, -0.020124505207786914]","[-0.2594465911388397, -0.04189436510205269, 0.21387137472629547, -0.011578009463846684, 0.1469215303659439, -0.29312747716903687, -0.13663148880004883, 0.011837229132652283, 0.11090346425771713, 0.30578964948654175]","[0.15272351273667378, -0.07314377286929508, -0.03293451865735635, -0.08022807922990785, -0.22686368032332904, 0.22964665337547016, -0.2616588912272399, -0.029255758998109796, -0.09908035357700186, 0.052720008458372186]"
17,N38836,hockey,"Sharks score first four goals, then hold off Wild","Thursday was the kind of game a lot of the Sharks needed. As did the team itself. San Jose scored four goals in the first period then held on for dear life to beat Minnesota 6-5 at SAP Center. The Sharks have strung consecutive victories together for the first time since winning three straight Oct. 10-16. And their latest victory included flashes of dominance ... before the team surrendered three late goals to make life hard on itself. ""There's...","Sharks score first four goals, then hold off Wild Thursday was the kind of game a lot of the Sharks needed. As did the team itself. San Jose scored four goals in the first period then held on for dear life to beat Minnesota 6-5 at SAP Center. The Sharks have strung consecutive victories together for the first time since winning three straight Oct. 10-16. And their latest victory included flashes of dominance ... before the team surrendered three late goals to make life hard on itself. ""There's...","[-0.055666618307922466, -0.021890994532835578, 0.002163496744589177, 0.01028380337618349, -0.055274104988244, 0.04711952901690973, -0.009791351856573854, -0.055631062048977595, -0.0329720077099242, -0.049189893880878036]","[0.22986948490142822, 0.19336605072021484, 0.3042606711387634, 0.02263033390045166, 0.0733400359749794, -0.04890098050236702, 0.05721317604184151, -0.039570052176713943, -0.2401583045721054, 0.2088264375925064]","[-0.2049509599067111, -0.1897084561407995, -0.13552169329096952, -0.014677082683954018, -0.12243724658625486, 0.0435474673701276, 0.017789450496469603, 0.08103139612075538, 0.08938544336188081, -0.05169250685726725]"
18,N18939,basketball,"Charles Barkley: 'At this point, Kawhi's a better player than LeBron'",TNT Analyst Charles Barkley said Kawhi Leonard is a better player than LeBron James.,"Charles Barkley: 'At this point, Kawhi's a better player than LeBron' TNT Analyst Charles Barkley said Kawhi Leonard is a better player than LeBron James.","[-0.08913342277410173, 0.027754596699923296, -0.03747897266770917, -0.09151611532036565, 0.13374463667131256, 0.08830828501411891, -0.05170559487955691, 0.09965039484901879, 0.05777026336242091, -0.03772843417912723]","[0.09222769737243652, -0.10879746079444885, 0.10863347351551056, -0.27633053064346313, 0.05179375410079956, -0.11549047380685806, 0.05827518180012703, 0.2093009352684021, 0.2234797477722168, 0.00015841919230297208]","[-0.06949882513798354, 0.18254702945183568, -0.08397286984063528, 0.18377866394928552, -0.04686571067304017, 0.0021982231252984353, -0.18921915877542309, -0.028718024306267114, -0.2614148198368395, 0.033988763622584045]"
19,N60740,basketball,The Denver Stiffs Show - The Nuggets aren't good when they're hungry,"On Halloween, the problems the Nuggets are facing can be quite frightening","The Denver Stiffs Show - The Nuggets aren't good when they're hungry On Halloween, the problems the Nuggets are facing can be quite frightening","[-0.031505881687917424, 0.006724713496520783, -0.028630030032625143, 0.0003671057628151807, 0.04222725037780664, 0.025415074073677116, 0.02845848008815405, -0.025073507559228003, -0.04710925936579824, -0.05430254551935102]","[0.14102157950401306, 0.022861860692501068, 0.23844844102859497, -0.2431277483701706, -0.07770849019289017, -0.0034072708804160357, -0.14311181008815765, -0.1816578060388565, -0.06252868473529816, -0.03409303352236748]","[-0.053611056243760655, -0.08259088523428598, -0.2228744433329494, 0.21316268593516735, -0.10726280695563496, 0.04451313352964927, 0.2201868237705934, 0.12018660968160741, -0.06749253215394775, 0.04201478161008077]"
20,N64130,outdoors,ON THE GUN: Browning X-Bolt Max Long Range,"Browning's new X-Bolt Max Long Range checks all the boxes for an affordable, long-range hunting rig: it's super accurate, runs flawlessly, it's heavy but still handy, and it costs just a little more than $1,000.","ON THE GUN: Browning X-Bolt Max Long Range Browning's new X-Bolt Max Long Range checks all the boxes for an affordable, long-range hunting rig: it's super accurate, runs flawlessly, it's heavy but still handy, and it costs just a little more than $1,000.","[-0.008508470338437369, 0.060206249321727426, -0.027251393364310275, 0.007697490165041599, -0.011922824327096035, 0.001670421816401829, 0.001974691685550864, -0.016039343233413435, -0.014892637131328715, -0.006284159292593678]","[0.13072754442691803, -0.021060368046164513, -0.0469382144510746, -0.0011207149364054203, 0.052726320922374725, 0.012563507072627544, -0.09652076661586761, 0.07404560595750809, 0.261112242937088, -0.09201833605766296]","[-0.06763787689466826, 0.139523793319627, 0.05579657981608454, -0.1486730240337455, 0.025852707164988636, 0.005110182337181113, 0.020893363375606044, -0.07175419806489966, -0.052686331456506516, -0.14067603433007722]"
