,news_id,general_category,title,abstract,text,tfidf_vector,sbert_vector,openai_vector
246,N35158,baseball,Joe Maddon has a three-year deal to manage the Angels,This is really no surprise.,Joe Maddon has a three-year deal to manage the Angels This is really no surprise.,"[-0.06644980361958738, 0.06088852951886786, 0.017362831961646785, 0.004296644028356768, 0.03619250709857809, -0.035425777357153, 0.019635570509025552, -0.012095477682145406, -0.08005734126620491, 0.06090137459499803]","[0.16718320548534393, -0.42419663071632385, 0.08806674182415009, 0.21465620398521423, -0.34020790457725525, 0.02824515663087368, 0.11478732526302338, -0.12673188745975494, 0.023169321939349174, 0.15039989352226257]","[0.004562066772869207, 0.3409518162057325, -0.22388286531917986, -0.07100228525515924, 0.18086556042037283, 0.023119015321661492, 0.0723706548643651, -0.03389552735734332, 0.10216613004120348, 0.1113117237489561]"
247,N25240,basketball,"James Harden, Rockets roll past Bulls","There was a time, way back in the beginning of the week, the Rockets were not hitting as many 3s as their opponent. That was never going to last. James Harden underlined the turnaround, hitting more than twice as many 3s as the Bulls managed on Saturday on his way to 42 points. But the Rockets had to be more encouraged with the way they shut down the Bulls on the other end to finish a second-half romp with a 117-94 win and their first...","James Harden, Rockets roll past Bulls There was a time, way back in the beginning of the week, the Rockets were not hitting as many 3s as their opponent. That was never going to last. James Harden underlined the turnaround, hitting more than twice as many 3s as the Bulls managed on Saturday on his way to 42 points. But the Rockets had to be more encouraged with the way they shut down the Bulls on the other end to finish a second-half romp with a 117-94 win and their first...","[-0.034900269259055476, -0.06183979774889561, 0.06258461818442307, -0.04761857138764536, 0.013547028301238169, 0.05250029108974297, -0.006893359229791784, 0.060337680260880086, 0.03941855497188856, -0.07647679529336858]","[0.26794862747192383, 0.04419158026576042, 0.2848837673664093, -0.37069225311279297, 0.14199981093406677, -0.021248359233140945, 0.23246802389621735, 0.06986617296934128, 0.05198526009917259, -0.06251831352710724]","[-0.23563612334132006, -0.025775137136571157, -0.18162895946072338, 0.17747115363598173, -0.18069178597462046, -0.09024530513741767, -0.10603570251271788, -0.034624792558063215, 0.07693392603636268, -0.10325264506097949]"
248,N58886,basketball,Iowa State Women's Basketball: Cyclones' late comeback falls short at Drake,"DES MOINES   Trailing by 17 points, on the road in a raucous environment is where the Iowa State women's basketball team found itself Sunday afternoon, but midway through the fourth quarter the Cyclones had whittled the deficit down to one. A 3-pointer by Drake guard Kierra Collier immediately followed. The Cyclones again pulled within a point with under three minutes to play, but a put-back ...","Iowa State Women's Basketball: Cyclones' late comeback falls short at Drake DES MOINES   Trailing by 17 points, on the road in a raucous environment is where the Iowa State women's basketball team found itself Sunday afternoon, but midway through the fourth quarter the Cyclones had whittled the deficit down to one. A 3-pointer by Drake guard Kierra Collier immediately followed. The Cyclones again pulled within a point with under three minutes to play, but a put-back ...","[-0.10281854834166994, -0.08608208533184346, -0.0993869882287302, -0.02797266410298878, -0.1185275750461232, 0.015153884483316471, -0.10015165276550497, -0.04047089997616157, 0.06249599478776822, -0.10507610272814986]","[0.34735873341560364, 0.2678872048854828, -0.12950560450553894, -0.25187352299690247, 0.018759986385703087, 0.019321803003549576, 0.036843493580818176, -0.040683988481760025, -0.12091993540525436, 0.04064495489001274]","[-0.32976443951530054, -0.11269973619222118, 0.09617238394806925, 0.06178740590559037, -0.175458259473704, 0.04338641838020669, 0.057436210110178895, 0.023865249378142217, 0.09444679184241694, 0.07232127008271476]"
249,N25892,baseball,Winners and losers from Game 1 of the World Series,A clutch Juan Soto performance and a surprising set of starts for Max Scherzer and Gerrit Cole saw the Nationals come away with a big win in Game 1 of the 2019 World Series.,Winners and losers from Game 1 of the World Series A clutch Juan Soto performance and a surprising set of starts for Max Scherzer and Gerrit Cole saw the Nationals come away with a big win in Game 1 of the 2019 World Series.,"[-0.15996127555428505, -0.03900308649217622, 0.3889508943059207, 0.31746218878016913, -0.13821757439068902, 0.007121462808629672, -0.07124813233843101, -0.019239649338936893, 0.006748652064204431, 0.047304649583938485]","[0.3264422118663788, 0.11314628273248672, 0.3031785786151886, 0.24710221588611603, 0.02902062237262726, 0.11689620465040207, 0.28174257278442383, -0.15890459716320038, -0.09467518329620361, 0.09001673758029938]","[-0.22944039346359188, -0.0018968877501042468, -0.26790159107801387, -0.13400426284436362, -0.022964083334600014, -0.06827011248698459, -0.11385931201903463, -0.19602690235196088, 0.13684242604254002, -0.02799541994579466]"
250,N14812,football,"Stephen A. Smith Believes This Team, Not Patriots, Is Favorite In AFC",https://www.dailymotion.com/embed/video/x nvtlb It only one was game but quite a bit of stock was put in the Week clash between the Patriots and Ravens. Baltimore handed New England its first,"Stephen A. Smith Believes This Team, Not Patriots, Is Favorite In AFC https://www.dailymotion.com/embed/video/x nvtlb It only one was game but quite a bit of stock was put in the Week clash between the Patriots and Ravens. Baltimore handed New England its first","[0.22167129662424548, 0.2951360476253664, 0.08914762480005343, -0.026837869206403794, -0.11804742007399391, 0.04546108045649401, -0.05837768115889636, 0.12161676430241858, 0.11461701384618818, -0.0649457492902689]","[-0.29315948486328125, 0.12297962605953217, 0.15536750853061676, 0.035548631101846695, -0.06490115821361542, -0.13851863145828247, -0.06497085839509964, 0.06922336667776108, 0.2728687822818756, 0.18298882246017456]","[0.14931709531370635, -0.11892452769252135, -0.13490829531515683, 0.010216308269374417, -0.012173477772802564, 0.07154459189172348, -0.1970536652651605, -0.16208865690947377, -0.23962452444999782, -0.06628423323813955]"
251,N26180,basketball,Game Thread: Denver Nuggets at Sacramento Kings,The first game of a back-to-back send the Nuggets to face off with the struggling Kings,Game Thread: Denver Nuggets at Sacramento Kings The first game of a back-to-back send the Nuggets to face off with the struggling Kings,"[-0.052716192107130154, -0.036664957562409305, -0.01989748677559405, 0.09675365403156802, -0.03943983534564152, 0.1090679760062932, -0.04099158511830349, 0.003926637331762161, -0.07905490517362725, -0.06712572551328357]","[0.19959458708763123, 0.15099583566188812, 0.3482933044433594, -0.25662243366241455, -0.06307018548250198, 0.022374320775270462, -0.1474061757326126, -0.031081896275281906, -0.07127242535352707, 0.01073466707020998]","[-0.15983050973792337, -0.12425581588445757, -0.1321669876174285, 0.20464798983882937, -0.22638945598634838, -0.14171937135995236, 0.1424708508839536, 0.06008255656179297, -0.024756019666810413, 0.09252213645029027]"
252,N57481,football,"NFL earns lowest score for racial, gender hiring in 15 years","The NFL received its lowest overall score in racial and gender hiring practices in 15 years, according a new diversity report.","NFL earns lowest score for racial, gender hiring in 15 years The NFL received its lowest overall score in racial and gender hiring practices in 15 years, according a new diversity report.","[0.11038586199864052, 0.08513845769860454, 0.04033462598500854, 0.021491949313198363, 0.024294792876533397, -0.0877837335487063, -0.03254897540901119, -0.10424837166978596, 0.011320084662299867, -0.13478459194928036]","[-0.1778784841299057, 0.02133812941610813, -0.0034834141843020916, -0.03188328072428703, -0.1350094974040985, -0.09422307461500168, -0.06860293447971344, -0.04064435511827469, 0.1716119945049286, -0.14728857576847076]","[0.15818420274044126, -0.09325369732321441, -0.00435797292964154, -0.16941005111163912, -0.011462172722719155, 0.08269015666751688, 0.08141506569278914, -0.13543609831147857, -0.16032971454085515, -0.05171377477561562]"
253,N27448,football,NFL world reacts to officials handing Packers win over Lions,"It's a regular occurrence for NFL officiating to cause controversy, with the Packers seeming to benefit from a questionable call against Lions defensive end Trey Flowers.","NFL world reacts to officials handing Packers win over Lions It's a regular occurrence for NFL officiating to cause controversy, with the Packers seeming to benefit from a questionable call against Lions defensive end Trey Flowers.","[0.1787493759353833, -0.18856101702905642, -0.00015688516212566904, 0.25166676161506213, 0.1920625218523292, -0.28155936735123654, -0.22766187128986146, 0.23962531122949718, -0.11495617734790177, -0.16897261390055957]","[-0.19755791127681732, 0.17562232911586761, 0.16156654059886932, 0.057520411908626556, -0.016813207417726517, -0.28604593873023987, -0.08416517078876495, -0.0577399842441082, 0.04277042672038078, -0.09523092955350876]","[0.13360750100281352, -0.1819425790341248, -0.08337244217920853, -0.14574861061535904, -0.20217926227312683, 0.17412412342441844, -0.05311435921848651, -0.10958218835188485, -0.06355749208203978, 0.06664272942992663]"
254,N34732,basketball,Former Suns center Marcin Gortat latest to bash franchise as it looks to change culture,"Days the Suns were criticized for the lack of development of Marquese Chriss, Marcin Gortat called them the worst organization he's ever played for.","Former Suns center Marcin Gortat latest to bash franchise as it looks to change culture Days the Suns were criticized for the lack of development of Marquese Chriss, Marcin Gortat called them the worst organization he's ever played for.","[-0.04033640114673892, 0.010015436497177977, 0.008597108252609578, -0.05649607321971667, 0.07906595964601418, 0.04081795761822806, 0.007778308637447886, 0.03069415817044526, -0.033241891837439266, -0.02803800646822046]","[0.15472641587257385, -0.23495541512966156, 0.15531933307647705, -0.23412686586380005, -0.05584346130490303, -0.08024708926677704, -0.05469641834497452, -0.03468697890639305, 0.10041691362857819, -0.08928132057189941]","[-0.043584828045631165, 0.15140080564095387, -0.1456904949126268, 0.206144293271069, -0.05523590995364329, 0.1442350809883162, 0.2075959317423427, 0.07676074841037828, -0.06203573026732053, -0.0066453542127691625]"
255,N7885,football,Man allegedly beaten by Gardens High football players has 'no clue' why he was targeted,"RIVIERA BEACH - The man allegedly beaten by at least four fellow high school students, including football standout Timothy Brown, then thrown from a moving SUV, says the one thing he can't figure out is why. ""I have no clue, sir. Honestly,"" the 18-year old said Tuesday. The Palm Beach Post is not naming him. Investigators have said the alleged victim originally had not cooperated, perhaps ...","Man allegedly beaten by Gardens High football players has 'no clue' why he was targeted RIVIERA BEACH - The man allegedly beaten by at least four fellow high school students, including football standout Timothy Brown, then thrown from a moving SUV, says the one thing he can't figure out is why. ""I have no clue, sir. Honestly,"" the 18-year old said Tuesday. The Palm Beach Post is not naming him. Investigators have said the alleged victim originally had not cooperated, perhaps ...","[-0.023047372448149507, 0.024184268190690108, -0.10951295183706378, -0.11167978977593084, -0.06074663540040531, -0.05289190457732183, 0.019962598274374754, 0.008678588101155372, -0.021631002752979484, 0.25406204711835234]","[-0.026606105268001556, -0.06146397069096565, -0.20589275658130646, -0.0101062823086977, 0.24237971007823944, -0.2023104429244995, -0.0631311684846878, -0.20395159721374512, 0.20916499197483063, -0.06285859644412994]","[0.08700929517412608, 0.08567049605366037, 0.32127358500866443, -0.05380523258721033, -0.08851500753491438, 0.1376874770968489, 0.03311072175510565, -0.047119574814095476, -0.05340514594055949, -0.028329943986450307]"
256,N40519,basketball,Creighton offers early-season test for Michigan basketball,"ANN ARBOR -- Michigan played its season opener against a team from the Sun Belt Conference that fired its coach after going 11-21 last year. The competition ramps up for game No. 2 on Tuesday night. The Wolverines welcome Creighton to Crisler Center (6:30 p.m. ET, FS1). The Blue Jays aren't ranked, but they're a Big East squad thought to be significantly better than Appalachian State. Michigan ...","Creighton offers early-season test for Michigan basketball ANN ARBOR -- Michigan played its season opener against a team from the Sun Belt Conference that fired its coach after going 11-21 last year. The competition ramps up for game No. 2 on Tuesday night. The Wolverines welcome Creighton to Crisler Center (6:30 p.m. ET, FS1). The Blue Jays aren't ranked, but they're a Big East squad thought to be significantly better than Appalachian State. Michigan ...","[-0.15273829867782668, -0.046832104909870366, -0.08647518192067567, -0.13202501810979378, -0.10656344850443678, 0.0700378286416135, -0.15841095267729022, 0.024444913760179456, 0.06033230678739899, 0.01810223776475736]","[0.3123563528060913, 0.2521935701370239, -0.21645240485668182, -0.12744230031967163, -0.12939901649951935, 0.19338107109069824, -0.14243780076503754, -0.07788065075874329, -0.10395868867635727, 0.24855826795101166]","[-0.3648195834586566, -0.043731399978815734, 0.12698967569928277, 0.16857678244024887, 0.06301395025742676, -0.010570132655823895, 0.05872017146619738, -0.11859243109168542, -0.10346440668973375, 0.14436417932794746]"
257,N12847,basketball,Paul Pierce says a weight has been lifted from Celtics,"Paul Pierce was chatting on the sideline at TD Garden this week when he was bear-hugged from behind. ""Aaaaah,"" said the Celtic legend in mock pain. ""Who is this, Danny? This feels like Danny."" ""Because I'm so strong,"" said Ainge. There was much laughter between the two before the Celts went out and scored a []","Paul Pierce says a weight has been lifted from Celtics Paul Pierce was chatting on the sideline at TD Garden this week when he was bear-hugged from behind. ""Aaaaah,"" said the Celtic legend in mock pain. ""Who is this, Danny? This feels like Danny."" ""Because I'm so strong,"" said Ainge. There was much laughter between the two before the Celts went out and scored a []","[0.02323305961364317, 0.02295273000808715, -0.018268971796603133, -0.017535244252930796, 0.03632627885552176, 0.029000503373332986, 0.017280182158330496, -0.043492761298657354, -0.02236428113946496, 0.04330885524894677]","[0.10986525565385818, -0.1608678549528122, 0.09790363162755966, -0.2525995075702667, 0.12781143188476562, -0.1442289501428604, -0.014502918347716331, 0.026206402108073235, -0.03336289897561073, 0.043004054576158524]","[0.03823249716566497, 0.17538672834521804, -0.09408389024910574, 0.1676300364519211, -0.18802417121039286, 0.109609377132773, -0.13625779699262364, -0.0015969242520039932, -0.04828681392363357, -0.023457609861404632]"
258,N27882,racing,Ryan: Help thy enemy? Why it was the best strategy on Kansas restarts,Here's the reason Chase Elliott was pushing Joey Logano to a Stage 1 win.,Ryan: Help thy enemy? Why it was the best strategy on Kansas restarts Here's the reason Chase Elliott was pushing Joey Logano to a Stage 1 win.,"[-0.07642547646751018, -0.048435303583624516, 0.03736067949983495, -0.03234604610129557, 0.025166162827510503, -0.17687728092023364, 0.16559175298347542, -0.006616076034876551, 0.0663485038133766, -0.18868415511275666]","[0.08771656453609467, 0.12267555296421051, 0.13839513063430786, 0.2861592769622803, 0.08400634676218033, -0.10116128623485565, -0.002975419396534562, 0.3428623080253601, -0.11473672837018967, 0.12396541237831116]","[-0.05471621636379218, 0.0003737456063039409, -0.14017804653945207, -0.20707052253372527, -0.026240022005523847, 0.08109603476273744, -0.07701740905628339, 0.34129372305258965, -0.07031820047490947, 0.02318722900319789]"
259,N58829,football,Cincinnati Bengals release defensive end Anthony Zettel,The Bengals cut defensive end Anthony Zettel after five days.,Cincinnati Bengals release defensive end Anthony Zettel The Bengals cut defensive end Anthony Zettel after five days.,"[-0.007662623098138642, -0.0022416923919695254, -0.02911338030823786, -0.02973601231780684, 0.1368226632149621, 0.00979309737832944, -0.05687947979023471, 0.048254359278707276, -0.031254862954035734, -0.08117318564090453]","[-0.12208528816699982, -0.17084428668022156, -0.22797457873821259, 0.020600220188498497, 0.03690381720662117, 0.07649119198322296, 0.018787799403071404, -0.1521597057580948, -0.03451155498623848, -0.09645290672779083]","[0.2546358915394104, 0.04698623017554617, 0.13403247770524396, 0.026731352327886676, -0.06223595009088606, 0.0005739528432770497, 0.29422155091434626, -0.026145341406052198, 0.12074054669741001, -0.06665268003560341]"
260,N24222,fighting,Zawada discusses must-win fight vs Khabib's cousin at UFC Moscow,The German welterweight is still after his first UFC win and welcomes Abubakar Nurmagomedov to the octagon on Saturday night.,Zawada discusses must-win fight vs Khabib's cousin at UFC Moscow The German welterweight is still after his first UFC win and welcomes Abubakar Nurmagomedov to the octagon on Saturday night.,"[-0.03084349531388527, -0.10282130614024543, -0.006247653105730058, 0.037589438008994135, -0.07710207777374478, 0.040562121338566244, 0.11052382861421745, 0.21706394953110728, -0.02097154002934274, -0.058113502905831574]","[0.19981366395950317, -0.024375082924962044, -0.00017127286992035806, 0.20401790738105774, 0.14879678189754486, -0.058087825775146484, -0.07184575498104095, 0.08221137523651123, -0.0995049700140953, -0.030829740688204765]","[-0.03313953730791361, 0.10318635432221816, 0.11906526986242633, -0.07070121085152926, 0.008548576601760763, 0.03956095275370618, -0.011417150792830557, 0.09620549197515327, -0.12706695508523025, 0.034350479736274385]"
261,N1884,basketball,"Cleveland Cavaliers' Kevin Porter Jr. 'can be a star, will have amazing career,' Wizards' Isaiah Thomas says","WASHINGTON, D.C. -- Shortly after the final buzzer Friday night, Kevin Porter Jr. and Isaiah Thomas met on the court for a jersey swap. Two Seattle hoopers reuniting. The region and a shared love of basketball first brought Porter and Thomas together years ago. That bond has continued to thicken ever since, extending far beyond the court. ""I've known him since a little bit before high school,"" ...","Cleveland Cavaliers' Kevin Porter Jr. 'can be a star, will have amazing career,' Wizards' Isaiah Thomas says WASHINGTON, D.C. -- Shortly after the final buzzer Friday night, Kevin Porter Jr. and Isaiah Thomas met on the court for a jersey swap. Two Seattle hoopers reuniting. The region and a shared love of basketball first brought Porter and Thomas together years ago. That bond has continued to thicken ever since, extending far beyond the court. ""I've known him since a little bit before high school,"" ...","[-0.056579097647393425, 0.009336666849183222, -0.02036351025686555, -0.035063460191642, -0.06345551039615123, -0.04798770417348079, -0.005393043588214199, 0.002132170367663683, 0.016496870041754628, 0.045728025409284515]","[0.154371440410614, -0.1683599203824997, 0.002100397367030382, -0.41494160890579224, 0.22510451078414917, 0.006816286593675613, 0.08875088393688202, 0.07612232863903046, 0.16169051826000214, -0.06954813003540039]","[-0.09018347989367377, 0.2585029277326676, 0.035304696801158345, 0.30208700986144654, -0.03387704085538091, -0.031490402327546116, -0.11933771960959837, 0.05330963253536451, -0.1070422222234418, -0.08903068614424545]"
262,N26346,football,Dan Quinn cedes defensive coordinator duties to Jeff Ulbrich,The linebackers coach may be preparing to be the team's interim defensive coordinator as Dan Quinn continues to shed duties.,Dan Quinn cedes defensive coordinator duties to Jeff Ulbrich The linebackers coach may be preparing to be the team's interim defensive coordinator as Dan Quinn continues to shed duties.,"[-0.008115792711850284, -0.0185489275410217, -0.06640645894585409, -0.018157289617225, 0.09555883958586847, -0.06376317573635373, -0.08101059421885089, 0.07399170702317093, -0.02011486596518736, 0.023680968764958177]","[-0.10551025718450546, 0.01256389170885086, -0.24810583889484406, 0.008356200531125069, -0.07300898432731628, -0.2037505805492401, -0.1018381342291832, -0.07204656302928925, -0.0782739520072937, 0.14480723440647125]","[0.20485291645133724, 0.04519896575459148, 0.05933650328035485, 0.0347539484830424, 0.10705418226347913, 0.021118584738231323, 0.14422576052843117, 0.11019292073278343, 0.12173217721907229, 0.13368090646968986]"
263,N42896,football,Texans WR Will Fuller expected to miss 'several weeks' with hamstring injury,"This is a huge blow for the Texans, as Fuller is one of the most dangerous deep threats in the game and has tremendous chemistry with Deshaun Watson.","Texans WR Will Fuller expected to miss 'several weeks' with hamstring injury This is a huge blow for the Texans, as Fuller is one of the most dangerous deep threats in the game and has tremendous chemistry with Deshaun Watson.","[-0.007045865143811988, -0.006316893608565035, -0.04179695641488991, 0.10472124208589645, 0.02693810559720767, 0.026311418657182038, 0.016231034960520908, -0.04657216236177613, 0.01333228373812282, 0.031279714860424225]","[-0.2418808788061142, -0.12333511561155319, -0.10183621942996979, 0.013400519266724586, 0.16928184032440186, 0.33186930418014526, 0.009578452445566654, -0.11647336184978485, -0.010632937774062157, 0.03969977796077728]","[0.1894675538011644, -0.03691528211884365, 0.16838764382218643, 0.0793795051089075, -0.05494014854626455, -0.24693311990759675, -0.12126829646004102, -0.07206380274532163, 0.04574734181229148, 0.051132813688488855]"
264,N57052,football,Patrick Mahomes expected to miss 3-6 weeks | FOX NFL Kickoff,Peter Schrager on Patrick Mahomes' injury,Patrick Mahomes expected to miss 3-6 weeks | FOX NFL Kickoff Peter Schrager on Patrick Mahomes' injury,"[0.10021702367925847, -0.0354554171567249, -0.11980532056148663, 0.20937728299950129, 0.22356263118693667, -0.07249838102410004, 0.1024527174175485, -0.1852330328274941, 0.26798333228966376, 0.11933711377210665]","[-0.297188937664032, -0.03470490500330925, 0.08100491762161255, -0.015687862411141396, 0.19218899309635162, 0.26178839802742004, -0.1816910356283188, 0.06574051082134247, -0.04075009375810623, 0.23839430510997772]","[0.2729771196981005, -0.07881157616129712, -0.0036227631050065293, -0.013978983598285026, 0.025276995464757743, -0.27096009473575644, -0.1227563560711616, 0.0499199143022977, -0.04208332821662148, 0.1948196427854702]"
265,N1953,football,What bowl games are Memphis football projected to play in?,"Now that Memphis is bowl eligible, what bowl games are the Tigers' projected to play in? We take a look.","What bowl games are Memphis football projected to play in? Now that Memphis is bowl eligible, what bowl games are the Tigers' projected to play in? We take a look.","[-0.0002749702148438482, -0.05400939619990865, -0.09596560024615913, -0.002912877317706377, -0.012518255373894272, -0.04684023711425297, -0.11005177678982676, -0.03195636524391167, 0.032784844667010885, 0.06597093563068392]","[0.07244356721639633, 0.2123241126537323, -0.1511572152376175, 0.02253616228699684, -0.3158639371395111, 0.22601063549518585, -0.20419460535049438, -0.03892216458916664, 0.18886612355709076, -0.04723739251494408]","[-0.08121506505739734, -0.0020430238176076714, 0.1350447904223143, -0.03832221547938092, 0.08885356303725782, -0.09762337393979564, 0.06069244389985416, -0.20007713266337288, -0.1952832303924914, 0.08276576344730174]"
266,N29041,basketball,Shaquille O'Neal donates home to family of Atlanta boy paralyzed in shooting,Shaquille O'Neal heard Isaiah Payton couldn't go home after he was paralyzed from the chest down. So Shaq donated an accessible house to his family.,Shaquille O'Neal donates home to family of Atlanta boy paralyzed in shooting Shaquille O'Neal heard Isaiah Payton couldn't go home after he was paralyzed from the chest down. So Shaq donated an accessible house to his family.,"[-0.04259381669161639, 0.025978531388239596, 0.019007948035784927, -0.017623920076318616, 0.05122356781231771, -0.012874167754521377, -0.012333922676681909, -0.027862901963653184, -0.04105625195676307, -0.010605784827518892]","[0.1532471925020218, -0.22056350111961365, -0.01328778825700283, -0.285247802734375, 0.27502766251564026, -0.08534258604049683, -0.05050397291779518, -0.024295881390571594, 0.13644137978553772, -0.0021527130156755447]","[0.01782892636220924, 0.2241949030304827, 0.16794455673776212, 0.04525038541140842, -0.18116945706559026, -0.017462974796358794, -0.05433125775469951, 0.11569219840920231, -0.04060840200778341, -0.15583320217797275]"
